{
  "scenario_version": "1.1",
  "scenario_id": "PAIRWISE-MCP-CROSS-CONSUMPTION-01",
  "target_id": "AICP-BASE@0.1+BIND-MCP@0.1",
  "message_flow": ["CONTRACT_PROPOSE", "CONTRACT_ACCEPT", "ATTEST_ACTION"],
  "freshness": {
    "run_count": 2,
    "fresh_fields": ["run_id", "challenge", "session_id", "contract_id", "message_id"],
    "semantic_equivalence_required": true
  },
  "challenge_binding": {
    "proposal_contract_goal": "run.challenge",
    "acceptance_peer_message": "actual_consumed_proposal",
    "attestation_peer_message": "actual_consumed_acceptance"
  }
}
